[
  {
    "id": "sakani_program",
    "name_ar": "برنامج سكني",
    "name_en": "Sakani Housing Program",
    "type": "برنامج توفير",
    "operator_ar": "شركة سكني (مملوكة لصندوق الاستثمارات العامة)",
    "supervisor_ar": "وزارة الشؤون البلدية والقروية والإسكان",
    "established_year": 2017,
    "vision_2030_target_ar": "رفع نسبة تملك المواطنين للمساكن إلى 70% بحلول عام 2030",
    "beneficiaries_ar": [
      "المواطنون السعوديون الراغبون في تملك مسكن أول",
      "المواطنون المؤهلون للحصول على دعم سكني من صندوق التنمية العقارية",
      "الأسر ذات الدخل المحدود والمتوسط الراغبة في حلول سكنية ميسّرة"
    ],
    "benefits_ar": [
      "عروض وحدات سكنية جاهزة بأسعار مدعومة في مناطق متعددة",
      "تسهيل الوصول إلى منتجات التمويل العقاري المدعوم من صندوق التنمية العقارية",
      "خيارات متنوعة تشمل الفلل والشقق والأراضي السكنية",
      "ربط المستفيد بالعروض المناسبة لدخله وموقعه الجغرافي المفضل"
    ],
    "application_process_ar": "يتقدم المواطن عبر البوابة الرسمية sakani.com.sa بتسجيل حساب وتعبئة بياناته الأسرية والمالية، ثم يُحدَّد أهليته لنوع الدعم المناسب، ويختار من العروض المتاحة في منطقته",
    "application_url": "https://www.sakani.com.sa",
    "geographic_scope_ar": "وطني — يشمل جميع مناطق المملكة",
    "status_ar": "نشط",
    "source_url": "https://www.sakani.com.sa",
    "last_verified": "2026-05-21",
    "audience": ["مالك"]
  },
  {
    "id": "redf",
    "name_ar": "صندوق التنمية العقارية السعودي",
    "name_en": "Saudi Real Estate Development Fund (REDF)",
    "type": "دعم تمويلي",
    "operator_ar": "صندوق التنمية العقارية السعودي",
    "supervisor_ar": "وزارة الشؤون البلدية والقروية والإسكان",
    "established_year": 1974,
    "vision_2030_target_ar": "تمويل 300,000 أسرة سعودية سنوياً وتحقيق هدف نسبة التملك البالغة 70% بحلول 2030",
    "beneficiaries_ar": [
      "المواطنون السعوديون الذكور والإناث الراغبون في بناء أو شراء مسكن أول",
      "المستحقون للدعم السكني وفق معايير الأهلية المالية وعدم سبق التملك",
      "المواطنون الراغبون في ترميم أو توسعة مسكنهم القائم"
    ],
    "benefits_ar": [
      "قروض إسكانية مدعومة بفائدة مخفضة أو صفرية للمستحقين",
      "دعم شهري مالي للمواطنين المؤهلين الذين يسددون قرضاً عقارياً من البنوك",
      "منتجات تمويلية متعددة: القرض المباشر، الشراكة مع البنوك، دعم الإيجار",
      "برامج لذوي الاحتياجات الخاصة وكبار السن وذوي الدخل المنعدم"
    ],
    "application_process_ar": "يتقدم المواطن عبر بوابة redf.gov.sa أو من خلال منصة سكني المرتبطة بالصندوق، وتُحدَّد أهليته وفق معايير الدخل والوضع الأسري والتملك السابق، ثم يختار المنتج التمويلي المناسب ويُكمل الإجراءات مع البنك الشريك",
    "application_url": "https://www.redf.gov.sa",
    "geographic_scope_ar": "وطني — يشمل جميع مناطق المملكة",
    "status_ar": "نشط",
    "source_url": "https://www.redf.gov.sa",
    "last_verified": "2026-05-21",
    "audience": ["مالك"]
  },
  {
    "id": "nhc",
    "name_ar": "شركة التطوير الوطني للإسكان",
    "name_en": "National Housing Company (NHC)",
    "type": "تطوير مباشر",
    "operator_ar": "شركة التطوير الوطني للإسكان (NHC)",
    "supervisor_ar": "وزارة الشؤون البلدية والقروية والإسكان",
    "established_year": 2016,
    "vision_2030_target_ar": "المساهمة في رفع نسبة تملك المساكن وتوفير وحدات سكنية ميسّرة عالية الجودة لمختلف شرائح المواطنين",
    "beneficiaries_ar": [
      "المواطنون السعوديون الراغبون في تملك وحدات في مشاريع NHC",
      "المؤهلون للحصول على دعم صندوق التنمية العقارية ضمن مشاريع الشركة",
      "المستثمرون الراغبون في شراء وحدات في مشاريع NHC للإيجار أو الاستثمار"
    ],
    "benefits_ar": [
      "تطوير مشاريع إسكانية ضخمة متكاملة تشمل المرافق والخدمات",
      "توفير وحدات بأسعار تنافسية مدعومة بإمكانية التمويل من REDF",
      "التكامل مع برنامج سكني لتيسير الوصول للعروض عبر منصة موحدة",
      "مشاريع في مناطق متعددة تشمل الرياض وجدة والمنطقة الشرقية والمدينة المنورة"
    ],
    "application_process_ar": "يطّلع المواطن على مشاريع NHC عبر موقع الشركة أو منصة سكني، ويختار الوحدة المناسبة ثم يتقدم بطلب حجز، ويُكمل إجراءات التمويل مع صندوق التنمية العقارية أو البنوك الشريكة",
    "application_url": "https://nhc.com.sa",
    "geographic_scope_ar": "وطني — تركيز أولي في الرياض وجدة والمنطقة الشرقية والمدينة المنورة",
    "status_ar": "نشط",
    "source_url": "https://nhc.com.sa",
    "last_verified": "2026-05-21",
    "audience": ["مالك", "مستثمر"]
  },
  {
    "id": "roshn",
    "name_ar": "شركة روشن العقارية",
    "name_en": "ROSHN Real Estate",
    "type": "تطوير مباشر",
    "operator_ar": "شركة روشن (صندوق الاستثمارات العامة)",
    "supervisor_ar": "صندوق الاستثمارات العامة",
    "established_year": 2019,
    "vision_2030_target_ar": "تطوير مجمعات سكنية متكاملة وعصرية تُساهم في رفع جودة الحياة وتحقيق مستهدفات التملك السكني",
    "beneficiaries_ar": [
      "المواطنون السعوديون الراغبون في تملك وحدات في مجمعات روشن",
      "الأسر الراغبة في العيش في مجتمعات متكاملة ذات خدمات ومرافق متطورة",
      "المؤهلون لتمويل REDF من ضمن مشاريع روشن"
    ],
    "benefits_ar": [
      "مجمعات سكنية متكاملة تشمل المدارس والمراكز الصحية والمراكز التجارية وملاعب الترفيه",
      "وحدات سكنية متنوعة بين الفلل والتاون هاوس والشقق",
      "بنية تحتية عصرية وتصميم عمراني مستدام",
      "إمكانية التمويل عبر صندوق التنمية العقارية والبنوك الشريكة"
    ],
    "application_process_ar": "يتصفح المهتم مشاريع روشن عبر الموقع الرسمي، ويحجز وحدته إلكترونياً مع سداد رسوم الحجز، ثم يُكمل إجراءات التمويل مع الجهة التمويلية المختارة وينتظر موعد التسليم وفق جدول المشروع",
    "application_url": "https://www.roshn.sa",
    "geographic_scope_ar": "الرياض (SEDRA وGABLEL)، جدة (ALAROUS)، الدمام والمنطقة الشرقية، المدينة المنورة",
    "status_ar": "نشط",
    "source_url": "https://www.roshn.sa",
    "last_verified": "2026-05-21",
    "audience": ["مالك", "مستثمر"]
  },
  {
    "id": "rental_subsidy_program",
    "name_ar": "برنامج الدعم السكني — دعم الإيجار",
    "name_en": "Housing Support Program — Rental Subsidy",
    "type": "دعم تمويلي",
    "operator_ar": "صندوق التنمية العقارية السعودي",
    "supervisor_ar": "وزارة الشؤون البلدية والقروية والإسكان",
    "established_year": 2017,
    "vision_2030_target_ar": "توفير خيارات سكنية ميسّرة للمواطنين عبر دعم تكاليف الإيجار ريثما يتمكنوا من الحصول على سكن مملوك",
    "beneficiaries_ar": [
      "المواطنون السعوديون المستأجرون غير المالكين لمسكن",
      "المستحقون وفق معايير الأهلية المالية لصندوق التنمية العقارية",
      "الأسر ذات الدخل المحدود التي لا تزال تنتظر الحصول على حل إسكاني مناسب"
    ],
    "benefits_ar": [
      "دعم مالي شهري يُودَع مباشرةً لحساب المستفيد لتغطية جزء من تكلفة الإيجار",
      "ربط تلقائي مع منصة إيجار لضمان توثيق عقد الإيجار وتحديثه",
      "إمكانية الجمع بين دعم الإيجار والتأهيل للحصول على تمويل شراء مسكن مستقبلاً"
    ],
    "application_process_ar": "يتقدم المواطن عبر بوابة صندوق التنمية العقارية redf.gov.sa ويُثبت أهليته بتقديم وثائق الدخل والعقد الإيجاري الموثق في منصة إيجار، ثم تُحدَّد قيمة الدعم وفق الفئة المحددة",
    "application_url": "https://www.redf.gov.sa",
    "geographic_scope_ar": "وطني — يشمل جميع مناطق المملكة",
    "status_ar": "نشط",
    "source_url": "https://www.redf.gov.sa",
    "last_verified": "2026-05-21",
    "audience": ["مستأجر"]
  },
  {
    "id": "wusool_program",
    "name_ar": "برنامج وصول",
    "name_en": "Wusool Accessibility Housing Program",
    "type": "دعم تمويلي",
    "operator_ar": "صندوق التنمية العقارية السعودي",
    "supervisor_ar": "وزارة الموارد البشرية والتنمية الاجتماعية",
    "established_year": 2019,
    "vision_2030_target_ar": "تعزيز الاندماج الاجتماعي ودعم ذوي الاحتياجات الخاصة وكبار السن في الحصول على مساكن ملائمة وميسّرة",
    "beneficiaries_ar": [
      "المواطنون السعوديون من ذوي الإعاقة الحاصلون على بطاقة إعاقة معتمدة",
      "كبار السن السعوديون الذين تجاوزوا الخامسة والستين من العمر",
      "الأسر التي يعولها أحد ذوي الإعاقة وتتطلع للحصول على سكن مهيّأ"
    ],
    "benefits_ar": [
      "قروض سكنية بشروط ميسّرة وبدون فوائد للفئات المؤهلة",
      "دعم إضافي لتهيئة المسكن وتكييفه مع متطلبات ذوي الإعاقة (منحدرات ومراحيض ومداخل خاصة)",
      "أولوية في قوائم الانتظار للحصول على عروض سكني",
      "خدمات متخصصة لتيسير الإجراءات عبر الصندوق"
    ],
    "application_process_ar": "يتقدم المستفيد عبر بوابة صندوق التنمية العقارية مرفقاً بشهادة الإعاقة أو وثيقة تأكيد السن، ويُكمل نموذج الطلب الخاص ببرنامج وصول ليُحدَّد المنتج التمويلي المناسب لحالته",
    "application_url": "https://www.redf.gov.sa",
    "geographic_scope_ar": "وطني — يشمل جميع مناطق المملكة",
    "status_ar": "نشط",
    "source_url": "https://www.redf.gov.sa",
    "last_verified": "2026-05-21",
    "audience": ["مالك"]
  },
  {
    "id": "white_land_initiative",
    "name_ar": "نظام رسوم الأراضي البيضاء",
    "name_en": "White Land Fee Initiative",
    "type": "برنامج توفير",
    "operator_ar": "وزارة الشؤون البلدية والقروية والإسكان",
    "supervisor_ar": "وزارة الشؤون البلدية والقروية والإسكان",
    "established_year": 2016,
    "vision_2030_target_ar": "تحفيز تطوير الأراضي غير المطوَّرة داخل النطاق العمراني لزيادة المعروض السكني وخفض أسعار الأراضي",
    "beneficiaries_ar": [
      "المواطنون الراغبون في الاستفادة من عرض أراضٍ إضافية داخل النطاق العمراني",
      "المطورون العقاريون الراغبون في الاستحواذ على أراضٍ بأسعار أكثر تنافسية",
      "المجتمع ككل من خلال زيادة المعروض السكني وخفض الأسعار"
    ],
    "benefits_ar": [
      "تحفيز أصحاب الأراضي على تطويرها أو بيعها بدلاً من تركها شاغرة",
      "زيادة المعروض من الأراضي السكنية داخل النطاق العمراني",
      "كبح ارتفاع أسعار الأراضي وإتاحتها بأسعار أكثر عدالة",
      "إعفاء من الرسوم عند الشروع الفعلي في التطوير ضمن المهل المحددة"
    ],
    "application_process_ar": "لا يتطلب تقديم طلب من المالك — تُفرض الرسوم تلقائياً على الأراضي البيضاء المؤهلة بنسبة 2.5% من قيمة الأرض سنوياً. يُعفى المالك من الرسوم إذا حصل على رخصة بناء وبدأ التطوير الفعلي خلال المهلة المحددة",
    "application_url": "https://mc.gov.sa/ar/Pages/default.aspx",
    "geographic_scope_ar": "المدن الكبرى وما يحيط بها من مناطق تقع ضمن النطاق العمراني المعتمد",
    "status_ar": "نشط",
    "source_url": "https://mc.gov.sa/ar/Pages/default.aspx",
    "last_verified": "2026-05-21",